"id","idCategoriaLegislacao","idStatusLegislacao","numero","ano","link","sumula","nomeArquivo","created_at","updated_at","nome","remoto"
"4","13","2","5966","2021","","DISPÕE SOBRE ENTREGA DE MERCADORIAS EM DOMICÍLIO NA ONDA ROXA",,"12/3/2021 15:28:43","2/6/2021 16:18:54",,"0"
"5","13","2","5989","2021","","DISPÕE SOBRE A ADOÇÃO DE MEDIDAS DE CARÁTER EMERGENCIAL E DE PREVENÇÃO NO CONTEXTO DA PANDEMIA DA COVID-19, NO MUNICÍPIO DE FRONTEIRA E DA OUTRAS PROVIDÊNCIAS ",,"5/4/2021 13:47:56","2/6/2021 16:19:22",,"0"
"6","1","1","6009","2021","","ESTABELECE O PLANO DE AÇÃO DO MUNICÍPIO DE
FRONTEIRA/MG, PARA ATENDER O PADRÃO MÍNIMO DE
QUALIDADE DO SISTEMA ÚNICO E INTEGRADO DE EXECUÇÃO
ORÇAMENTÁRIA, ADMINISTRAÇÃO FINANCEIRA E CONTROLE –
SIAFIC, NOS TERMOS DO PARÁGRAFO ÚNICO, DO ART. 18o, DO
DECRETO FEDERAL No 10.540, DE 5 DE NOVEMBRO DE 2020",,"28/4/2021 10:17:42","28/4/2021 10:17:42",,"0"
"7","1","1","5911","2021","","APROVA O CALENDARIO OFICIAL DE FERIADOS E PONTOS FACULTATIVOS PARA O EXERCICIO DE 2021 NO MUNICÍPIO DE FRONTEIRA",,"7/5/2021 15:21:53","7/5/2021 15:21:53",,"0"
"8","9","1","1934","2021","","CONCEDE SUBVENÇÃO SOCIAL A ASSISTÊNCIA SOCIAL – ASILO PIO XII E DÁ OUTRAS PROVIDÊNCIAS",,"25/5/2021 15:09:15","25/5/2021 15:09:15",,"0"
"9","9","1","1935","2021","","   DISPÕE SOBRE A ABERTURA DE CRÉDITO ADICIONAL PARA SUPLEMENTAÇÃO DE VERBAS DO ORÇAMENTO VIGENTE",,"25/5/2021 15:29:23","25/5/2021 15:29:23",,"0"
"10","9","1","1936","2021","","DISPÕE SOBRE AUTORIZAÇÃO DE PERCENTUAL PARA REALOCAÇÕES DE SALDOS DE DOTAÇÕES ORÇAMENTÁRIAS DO ORÇAMENTO PARA O EXERCÍCIO DE 2021 E CONTÉM OUTRAS PROVIDÊNCIAS",,"25/5/2021 15:32:42","25/5/2021 15:32:42",,"0"
"11","9","1","1937","2021","","ALTERA DISPOSITIVO DA LEI 1.252, DE 11 DE AGOSTO DE 2005, E DA LEI Nº 1.802, DE 11 DE ABRIL DE 2018 ",,"25/5/2021 15:36:58","25/5/2021 15:36:58",,"0"
"12","9","1","1938","2021","","RATIFICA PROTOCOLO DE INTENÇÕES FIRMADO ENTRE MUNICÍPIOS BRASILEIROS, COM A FINALIDADE DE ADQUIRIR VACINAR PARA COMBATE À PANDEMIA DO CORONAVÍRUS; MEDICAMENTOS, INSUMOS E EQUIPAMENTOS NA ÁREA DE SAÚDE ",,"25/5/2021 15:58:18","25/5/2021 15:58:18",,"0"
"13","9","1","1939","2021","","DISPÕE SOBRE A CRIAÇÃO DO CONSELHO MUNICIPAL DE ACOMPANHAMENTO E CONTROLE SOCIAL DO FUNDO DE MANUTENÇÃO E DESENVOLVIMENTO DA EDUCAÇÃO BÁSICA E DE VALORIZAÇÃO DOS PROFISSIONAIS DA EDUCAÇÃO – CACS/FUNDEB.",,"25/5/2021 16:01:47","25/5/2021 16:01:47",,"0"
"14","9","1","1940","2021","","DISPÕE SOBRE A POLÍTICA HABITACIONAL DE INTERESSE SOCIAL DO MUNICÍPIO, VOLTADA PARA A POPULAÇÃO DE BAIXA RENDA",,"25/5/2021 16:06:30","25/5/2021 16:06:30",,"0"
"15","3","1","0001","2021","","DISPÕE SOBRE REAJUSTE DOS VENCIMENTOS DOS AGENTES DE COMBATE ÀS ENDEMIAS (ACE) E AGENTES COMUNITÁRIOS DE SAÚDE (ACS), CONFORME VALORES ESTIPULADOS PELA LEI FEDERAL Nº 11.350/2006, ALTERADA PELA LEI FEDERAL Nº 13.708/2018.",,"25/5/2021 16:10:21","25/5/2021 16:11:11",,"0"
"16","9","1","1941","2021","","CONCEDE AUXÍLIO FINANCEIRO AO CONSELHO COMUNITÁRIO DE SEGURANÇA PÚBLICA E SOCIAL DE FRONTEIRA-MG (CONSEP) E DÁ OUTRAS PROVIDÊNCIAS",,"25/5/2021 16:15:31","25/5/2021 16:15:31",,"0"
"17","9","1","1942","2021","","CONCEDE SUBVENÇÃO SOCIAL AO CENTRO DE RECUPERAÇÃO DO ALCOÓLATRA (CEREA) E DA OUTRAS PROVIDÊNCIAS;",,"25/5/2021 16:31:52","25/5/2021 16:31:52",,"0"
"18","9","1","1943","2021","","AUTORIZA ABERTURA DE CRÉDITO ADICIONAL ESPECIAL NO ORÇAMENTO VIGENTE E DÁ OUTRAS PROVIDÊNCIAS",,"25/5/2021 16:36:22","25/5/2021 16:36:22",,"0"
"19","9","1","1944","2021","","AUTORIZA ABERTURA DE CRÉDITO ADICIONAL ESPECIAL NO ORÇAMENTO VIGENTE E DÁ OUTRAS PROVIDÊNCIAS",,"25/5/2021 16:38:09","25/5/2021 16:38:09",,"0"
"20","9","1","1945","2021","","AUTORIZA ABERTURA DE CRÉDITO ADICIONAL ESPECIAL NO ORÇAMENTO VIGENTE E DÁ OUTRAS PROVIDÊNCIAS",,"25/5/2021 16:41:21","25/5/2021 16:41:21",,"0"
"21","9","1","1946","2021","","AUTORIZA ABERTURA DE CRÉDITO ADICIONAL ESPECIAL NO ORÇAMENTO VIGENTE E DÁ OUTRAS PROVIDÊNCIAS",,"25/5/2021 16:46:56","27/5/2021 14:57:48",,"0"
"22","9","1","1947","2021","","AUTORIZA A ABERTURA DE CRÉDITO ADICIONAL ESPECIAL NO ORÇAMENTO VIGENTE E DÁ OUTRAS PROVIDÊNCIAS",,"27/5/2021 15:00:26","27/5/2021 15:00:26",,"0"
"23","9","1","1948","2021","","AUTORIZA A ABERTURA DE CRÉDITO ADICIONAL ESPECIAL NO ORÇAMENTO VIGENTE E DÁ OUTRAS PROVIDÊNCIAS",,"27/5/2021 15:02:26","27/5/2021 15:02:26",,"0"
"24","13","1","6030","2021","","DISPÕE SOBRE  A ADOÇÃO DE MEDIDAS DE CARÁTER EMERGENCIAL E DE PREVENÇÃO NO CONTEXTO DA PANDEMIA DO COVID-19, NO MUNICÍPIO DE FRONTEIRA E DA OUTRAS PROVIDÊNCIAS",,"2/6/2021 16:17:22","2/6/2021 16:17:22",,"0"
"25","3","1","0002","2021","","DISPÕE SOBRE O AFASTAMENTO DA GESTANTE SERVIDORA OU CONTRATADA POR PRAZO DETERMINADO, DO MUNICÍPIO DE FRONTEIRA, DAS ATIVIDADES DE TRABALHO PRESENCIAL DURANTE A EMERGÊNCIA DE SAÚDE PÚBLICA DE IMPORTÂNCIA MUNICIPAL DECORRENTE DO NOVO CORONAVÍRUS. ",,"22/6/2021 14:01:04","22/6/2021 14:01:04",,"0"
"26","9","1","1949","2021","","AUTORIZA O EXECUTIVO MUNICIPAL A CONCEDER DESCONTO SOBRE JUROS E MULTAS DOS TRIBUTOS MUNICIPAIS E DÁ OUTRAS PROVIDÊNCIAS",,"30/6/2021 09:20:35","30/6/2021 09:20:35",,"0"
"27","9","1","1950","2021","","AUTORIZA A ALIENAÇÃO DE BENS MÓVEIS E DÁ OUTRAS PROVIDÊNCIAS",,"1/7/2021 14:02:34","1/7/2021 14:02:34",,"0"
"28","9","1","1951","2021","","DA DENOMINAÇÃO AO CENTRO ADMINISTRATIVO II DE ""LEOVALDO PINEIS"" E DÁ OUTRAS PROVIDÊNCIAS",,"5/7/2021 09:05:30","5/7/2021 09:05:30",,"0"
"29","9","1","1952","2021","","DA DENOMINAÇÃO A AVENIDA 16 NA VILA CHICA DE ""DIVIDA EURIDES DE LIMA ROCHA"" E DÁ OUTRAS PROVIDÊNCIAS",,"5/7/2021 09:09:45","5/7/2021 09:09:45",,"0"
"30","3","1","0003","2021","","CRIA O PARCELAMENTO DO SOLO PARA FINS URBANO E RURAL NO MUNICÍPIO DE FRONTEIRA E DÁ OUTRAS PROVIDÊNCIAS.",,"22/7/2021 15:54:30","22/7/2021 15:54:30",,"0"
"31","9","1","1953","2021","","DISPÕE SOBRE A SUPLEMENTAÇÃO DE VERBAS DO ORÇAMENTO VIGENTE (CAMARA MUNICIPAL)",,"22/7/2021 15:59:43","22/7/2021 15:59:43",,"0"
"32","9","1","1954","2021","","REVOGA A LEI MUNICIPAL Nº 1.920 DE 11 DE AGOSTO DE 2020.",,"22/7/2021 16:00:41","22/7/2021 16:00:41",,"0"
"33","9","1","1955","2021","","CONCEDE AUXÍLIO FINANCEIRO AO CONSELHO COMUNITÁRIO DE SEGURANÇA PÚBLICA E SOCIAL DE FRONTEIRA-MG (CONSEP) E DÁ OUTRAS PROVIDÊNCIAS.",,"22/7/2021 16:02:00","22/7/2021 16:02:00",,"0"
"34","9","1","1956","2021","","INSTITUI A POLÍTICA MUNICIPAL DE TURISMO DE FRONTEIRA/MG, E DÁ OUTRAS PROVIDÊNCIAS.",,"22/7/2021 16:03:33","22/7/2021 16:03:33",,"0"
"35","13","1","6092","2021","","ALTERA AS MEDIDAS DE CARÁTER
EMERGENCIAL E DE PREVENÇÃO
NO CONTEXTO DA PANDEMIA Do
COVID-19, INSTITUIDO PELO
DECRETO N° 6.030, DE 21 DE
MAIO DE 2021 E DA OUTRASs
PROVIDENCIAS. ",,"26/7/2021 20:20:45","26/7/2021 20:20:45",,"0"
"36","1","1","6082","2021","","DECLARA DE UTILIDADE PÚBLICA, PARA FINS DE AMPLIAÇÃO DO CEMITÉRIO LOCAL, PARTE DA ÁREA DE IMÓVEL RURAL LOCALIZADO NO MUNICÍPIO DE FRONTEIRA E DÁ OUTRAS PROVIDÊNCIAS",,"4/8/2021 10:07:29","4/8/2021 10:07:29",,"0"
"37","13","1","6094","2021","","DISPÕE SOBRE A VOLTAS ÀS AULAS E RETORNO ÀS ATIVIDADES PRESENCIAIS, POR MEIO DO ENSINO HÍBRIDO, NAS ESCOLAS DA REDE PÚBLICA (ESTADUAL E MUNICIPAL), PARTICULAR E FILANTRÓPICAS E DÁ OUTRAS PROVIDENCIAS.",,"4/8/2021 10:11:37","4/8/2021 10:11:37",,"0"
"38","1","1","6093","2021","","ALTERA COMPOSIÇÃO E NOMEIA MEMBROS DA COMISSÃO MUNICIPAL DE DESENVOLVIMENTO ECONÔMICO - CMDE - E DÁ OUTRAS PROVIDÊNCIAS.",,"4/8/2021 10:14:40","4/8/2021 10:14:40",,"0"
"39","9","1","1957","2021","","APROVA A ATUALIZAÇÃO DO PLANO MUNICIPAL TURISMO - PMT DO MUNICÍPIO DE FRONTEIRA/MG, E DÁ OUTRAS PROVIDÊNCIAS.",,"16/8/2021 16:24:45","16/8/2021 16:24:45",,"0"
"40","9","2","1958","2021","","INCLUI NO PERÍMETRO URBANO DO MUNICÍPIO A ÁREA QUE  MENCIONA E DÁ OUTRAS PROVIDÊNCIAS. ",,"16/8/2021 16:26:26","30/9/2021 10:37:57",,"0"
"41","9","1","1959","2021","","REVOGA AS LEIS NºS 1.699, DE 04 DE DEZEMBRO DE 2015 E 1.700, DE 04 DE DEZEMBRO DE 2015, E REGULA A COBRANÇA PARA CESSÃO A PARTICULAR, PARA SERVIÇOS TRANSITÓRIOS, DE MAQUINÁRIO DO MUNICÍPIO.",,"16/8/2021 16:28:13","16/8/2021 16:28:13",,"0"
"42","9","1","1960","2021","","AUTORIZA O PODER EXECUTIVO A FIRMAR ACORDO DE PARCELAMENTO DE DÍVIDA ORIUNDA DO LEGISLATIVO MUNICIPAL COM O INSTITUTO NACIONAL DE SEGURIDADE SOCIAL – INSS E DÁ OUTRAS PROVIDÊNCIAS.",,"16/8/2021 16:31:21","16/8/2021 16:31:21",,"0"
"43","9","1","1961","2021","","DA DENOMINAÇÃO A NOVA CRECHE SITUADA NA RUA MIGUEL JOSÉ MIZIARA, Nº 947, COHAB, DE “CRECHE DONA ALICE” E DÁ OUTRAS PROVIDÊNCIAS",,"16/8/2021 16:33:18","16/8/2021 16:33:18",,"0"
"44","9","1","1962","2021","","DA DENOMINAÇÃO de “ANTONIO DE FREITAS CARVALHO” A RUA QUE COMEÇA NA RUA HUM E TERMINA NA AVENIDA SÃO PAULO, NA VILA CHICA  E DÁ OUTRAS PROVIDÊNCIAS.",,"16/8/2021 16:35:10","16/8/2021 16:35:10",,"0"
"45","9","1","1963","2021","","DA DENOMINAÇÃO A AVENIDA B NO JARDIM VERANEIO “ANOAR ASSEM MUSSI” E DÁ OUTRAS PROVIDÊNCIAS.",,"31/8/2021 14:22:06","31/8/2021 14:22:06",,"0"
"46","9","1","1964","2021","","INSTITUI A “CAMPANHA OFTALMOLOGICA NAS ESCOLAS DO MUNICÍPIO” E DÁ OUTRAS PROVIDÊNCIAS.",,"31/8/2021 14:24:04","31/8/2021 14:24:04",,"0"
"47","9","1","1965","2021","","CONCEDE REPOSIÇÃO SALARIAL AOS SERVIDORES DA CÂMARA MUNICIPAL DE FRONTEIRA/MG, REFERENTE AO EXERCÍCIO DE 2020.",,"31/8/2021 14:25:57","31/8/2021 14:25:57",,"0"
"48","9","1","1966","2021","","DISPÕE SOBRE A SUPLEMENTAÇÃO DE VERBAS DO ORÇAMENTO VIGENTE.",,"31/8/2021 14:30:48","31/8/2021 14:30:48",,"0"
"49","9","1","1667","2021","","AUTORIZA O PODER EXECUTIVO MUNICIPAL A PROMOVER PROCESSO DE TRANSFERÊNCIA DE IMÓVEIS NA FORMA QUE MENCIONA E DÁ OUTRAS PROVIDÊNCIAS.",,"2/9/2021 16:20:07","2/9/2021 16:20:07",,"0"
"50","9","1","1968","2021","","AUTORIZA A ABERTURA DE CRÉDITO ADICIONAL ESPECIAL NO ORÇAMENTO VIGENTE E DÁ OUTRAS PROVIDÊNCIAS. ",,"2/9/2021 16:21:08","2/9/2021 16:21:08",,"0"
"51","9","1","1969","2021","","AUTORIZA A ABERTURA DE CRÉDITO ADICIONAL ESPECIAL NO ORÇAMENTO VIGENTE E DÁ OUTRAS PROVIDÊNCIAS. ",,"2/9/2021 16:22:25","2/9/2021 16:22:25",,"0"
"53","9","1","1971","2021","","DA DENOMINAÇÃO A UNIDADE MISTA DE SAUDE DE FRONTEIRA DE   UNIDADE MISTA “DR. JULIO DA MAIA CACHAPUZ NETO” E DÁ OUTRAS PROVIDÊNCIAS.",,"25/11/2021 15:15:13","25/11/2021 15:15:13",,"0"
"54","9","1","1972","2021","","DISPÕE SOBRE AS DIRETRIZES PARA ELABORAÇÃO E EXECUÇÃO DA LEI ORÇAMENTÁRIA PARA EXERCÍCIO FINANCEIRO DO ANO DE 2022, E DÁ OUTRAS PROVIDÊNCIAS",,"25/11/2021 15:21:38","25/11/2021 15:21:38",,"0"
"55","9","1","1973","2021","","INCLUI NO PERÍMETRO URBANO DO MUNICÍPIO A ÁREA QUE MENCIONA E DÁ OUTRAS PROVIDÊNCIAS.",,"25/11/2021 15:43:36","25/11/2021 15:43:36",,"0"
"56","9","1","1974","2021","","DISPÕE SOBRE O PLANO PLURIANUAL PARA O PERÍODO DE 2022 A 2025 E DÁ OUTRAS PROVIDÊNCIAS.",,"25/11/2021 15:53:39","25/11/2021 15:53:39",,"0"
"57","9","1","1975","2021","","NOMEIA DE “ESF II – DR. RENATO DUPRAT” O ESF II, SITUADO NA AV. MINAS GERAIS, Nº 69, CENTRO E DÁ OUTRAS PROVIDÊNCIAS.",,"25/11/2021 16:12:36","25/11/2021 16:12:36",,"0"
"58","3","1","0004","2021","","DISPÕE SOBRE A RECOMPOSIÇÃO DOS VENCIMENTOS DOS PROFESSORES DA EDUCAÇÃO BÁSICA EM CONSONÂNCIA COM O PISO NACIONAL, CONFORME VALORES ESTIPULADOS PELA LEI FEDERAL Nº 11.708/2008.",,"25/11/2021 16:23:53","25/11/2021 16:23:53",,"0"
"59","9","1","1976","2021","","DISPÕE SOBRE AS MEDIDAS A SEREM TOMADAS EM CASO DE EXTRAVIO DE DOCUMENTOS DO ACERVO DO MUNICÍPIO E DÁ OUTRAS PROVIDÊNCIAS. ",,"17/12/2021 15:53:28","17/12/2021 15:53:28",,"0"
"60","9","1","1977","2021","","AUTORIZA O PODER EXECUTIVO A CONCEDER INCENTIVO CULTURAL A ARTISTAS, MÚSICOS, DUPLAS, BANDAS E GRUPOS MUSICAIS DO MUNICÍPIO DE FRONTEIRA-MG, E DÁ OUTRAS PROVIDÊNCIAS.",,"17/12/2021 15:56:42","17/12/2021 15:56:42",,"0"
"61","9","1","1978","2021","","CRIA O PROGRAMA “NATAL FELIZ ” E AUTORIZA O MUNICÍPIO DE FRONTEIRA-MG A ADQUIRIR E DISTRIBUIR BRINQUEDOS A CRIANÇAS VULNERÁVEIS E DÁ OUTRAS PROVIDÊNCIAS.",,"17/12/2021 15:58:26","17/12/2021 15:58:26",,"0"
"62","9","1","1979","2021","","AUTORIZA A CONCESSÃO DE AUXÍLIO FINANCEIRO AO CONSELHO COMUNITÁRIO DE SEGURANÇA PÚBLICA E SOCIAL DE FRONTEIRA-MG (CONSEP) E DÁ OUTRAS PROVIDÊNCIAS",,"17/12/2021 16:00:00","17/12/2021 16:00:00",,"0"
"63","9","1","1980","2021","","ALTERA O ART. 1º DA LEI 1.928 DE 09 DE DEZEMBRO DE 2020 E DÁ OUTRAS PROVIDÊNCIAS",,"17/12/2021 16:02:14","17/12/2021 16:02:14",,"0"
"64","9","1","1981","2021","","INCLUI NO PERIMETRO URBANO DO MUNICÍPIO A ÁREA QUE MENCIONA E DÁ OUTRAS PROVIDÊNCIAS",,"17/12/2021 16:03:09","17/12/2021 16:03:09",,"0"
"65","9","1","1982","2021","","INSTITUI O CALENDÁRIO DE EVENTOS OFICIAL DO MUNICÍPIO DE FRONTEIRA E DÁ OUTRAS PROVIDÊNCIAS",,"17/12/2021 16:04:16","17/12/2021 16:04:16",,"0"
"66","9","1","1983","2021","","DISPÕE SOBRE A MODIFICAÇÃO DO INCISO I DO ARTIGO 4º DA LEI MUNICIPAL Nº 1.933 DE 28 DE DEZEMBRO DE 2020;",,"17/12/2021 16:18:42","17/12/2021 16:18:42",,"0"
"67","9","1","1984","2021","","AUTORIZA O PODER EXECUTIVO MUNICIPAL A PROMOVER PROCESSO DE TRANSFERENCIA DE IMÓVEIS NA FORMA QUE MENCIONA E DÁ OUTRAS PROVIDENCIAS; ",,"17/12/2021 16:22:49","17/12/2021 16:22:49",,"0"
"68","9","1","1985","2021","","AUTORIZA O PAGAMENTO DE PARCELA EXTRA AO SERVIDOR INSCRITO NO PROGRAMA DE VALORIZAÇÃO DO SERVIDOR PARA O EXERCÍCIO DE 2021;",,"17/12/2021 16:23:49","17/12/2021 16:23:49",,"0"
"69","9","1","1986","2021","","ESTIMA A RECEITA E FIXA A DESPESA DO MUNICÍPIO DE FRONTEIRA PARA O EXERCÍCIO DE 2022, E DÁ OUTRAS PROVIDÊNCIAS.",,"17/12/2021 16:24:49","17/12/2021 16:24:49",,"0"
"70","3","1","0005","2021","","DISPÕE SOBRE A CONVALIDAÇÃO DOS ATOS PRATICADOS NA CONCORRÊNCIA PÚBLICA Nº 003/2020 – PROCESSO 0028165, BASEADOS NA LEI Nº 1.913, DE 15 DE ABRIL DE 2020 E DÁ OUTRAS PROVIDÊNCIAS.",,"17/12/2021 16:28:28","17/12/2021 16:28:28",,"0"
"71","3","1","0006","2021","","AUTORIZA O MUNICÍPIO A PROCEDER COM A CONCESSÃO GRATUITA DE DIREITO REAL DE USO DA ÁREA QUE MENCIONA E DÁ OUTRAS PROVIDÊNCIAS.",,"17/12/2021 16:30:03","17/12/2021 16:30:03",,"0"
"72","3","1","0007","2021","","AUTORIZA O PODER EXECUTIVO MUNICIPAL A CONCEDER DESCONTO SOBRE OS JUROS E AS MULTAS DOS TRIBUTOS MUNICIPAIS NO EXERCÍCIO DE 2022 E DÁ OUTRAS PROVIDÊNCIAS.",,"17/12/2021 16:32:12","17/12/2021 16:32:12",,"0"
"73","1","1","6293","2021","","DISPÕE SOBRE O CRONOGRAMA DE VENCIMENTO DO IPTU(IMPOSTO PREDIAL E TERRITORIAL URBANO) DO EXERCÍCIO DE 2022 DO MUNICÍPIO DE FRONTEIRA-MG",,"27/12/2021 21:29:28","27/12/2021 21:29:28",,"0"
"74","1","1","6294","2021","","NOMEIA COMISSÃO PARA AVALIAÇÃO DOS IMÓVEIS URBANOS E RURAIS DO MUNICÍPIO DE FRONTEIRA-MG, PARA FINS DE IMPOSTO SOBRE TRANSMISSÃO INTER VIVOS, DE BENS IMÓVEIS E DE DIREITOS A ELES RELATIVOS (ITBI).",,"27/12/2021 21:31:17","27/12/2021 21:31:17",,"0"
"75","1","1","6925","2021","","ALTERA O CALENDÁRIO OFICIAL DE FERIADOS E PONTOS FACULTATIVOS PARA O EXERCÍCIO DE 2021 NO MUNICÍPÍO DE FRONTEIRA.",,"27/12/2021 21:32:35","27/12/2021 21:32:35",,"0"
"76","1","1","6099","2021","","INSTRUMENTO DE PERMISSÃO DE USO",,"27/12/2021 21:33:50","27/12/2021 21:33:50",,"0"
"77","9","1","1987","2022","","DISPÕE SOBRE A CRIAÇÃO DO CONSELHO MUNICIPAL DE DESENVOLVIMENTO ECONOMICO SUSTENTÁVEL E DÁ OUTRAS PROVIDÊNCIAS.",,"7/2/2022 13:54:25","7/2/2022 13:54:25",,"0"
"80","13","1","6346","2022","","DISPÕE SOBRE A ADOÇÃO DE MEDIDAS DE CARÁTER EMERGENCIAL DE PREVENÇÃO NO CONTEXTO DA PANDEMIA DO COVID-19, NO MUNICÍPIO DE FRONTEIRA E DÁ OUTRAS PROVIDÊNCIAS; ",,"7/2/2022 14:59:29","7/2/2022 14:59:29",,"0"
"81","1","1","6308","2022","","CALENDÁRIO OFICIAL DE FERIADOS E PONTOS FACULTATIVOS PARA O EXERCÍCIO DE 2022 NO MUNICÍPIO DE FRONTEIRA",,"10/2/2022 15:53:52","10/2/2022 15:53:52",,"0"
"82","9","1","1988","2022","","REALOCAÇÃO ORÇAMENTÁRIA",,"10/2/2022 15:56:39","10/2/2022 15:56:39",,"0"
"83","9","1","1989","2022","","DISPÕE SOBRE A APREENSÃO, REGISTRO E CADASTRAMENTO DE ANIMAIS DE GRANDE PORTE SOLTOS NAS VIAS E LOGRADOUROS PÚBLICOS DA ZONA URBANA E RURAL DO MUNICÍPIO DE FRONTEIRA-MG E DÁ OUTRAS PROVIDÊNCIAS.",,"11/2/2022 15:11:56","11/2/2022 15:11:56",,"0"
"84","9","1","1990","2022","","CONCEDE SUBVENÇÃO SOCIAL AO ABRIGO GABRIEL LUIZ RIBEIRO E DÁ OUTRAS PROVIDÊNCIAS.",,"11/2/2022 15:13:12","11/2/2022 15:13:12",,"0"
"85","9","1","1991","2022","","CONCEDE SUBVENÇÃO SOCIAL A APAE (ASSOCIAÇÃO DE PAIS E AMIGOS DOS EXCEPCIONAIS) E DÁ OUTRAS PROVIDÊNCIAS.",,"11/2/2022 15:13:58","11/2/2022 15:13:58",,"0"
"86","9","1","1992","2022","","CONCEDE SUBVENÇÃO SOCIAL À ASSISTÊNCIA SOCIAL – ASILO PIO XII E DÁ OUTRAS PROVIDÊNCIAS.",,"11/2/2022 15:14:37","11/2/2022 15:14:37",,"0"
"87","9","1","1993","2022","","CONCEDE SUBVENÇÃO SOCIAL AO CENTRO DE RECUPERAÇÃO DO ALCOÓLATRA (CEREA) E DÁ OUTRAS PROVIDÊNCIAS.",,"11/2/2022 15:15:19","11/2/2022 15:15:19",,"0"
"88","9","1","1994","2022","","CONCEDE SUBVENÇÃO SOCIAL AO CONSELHO COMUNITÁRIO DE SEGURANÇA PÚBLICA E SOCIAL DE FRONTEIRA-MG (CONSEP) E DÁ OUTRAS PROVIDÊNCIAS.",,"11/2/2022 15:16:45","11/2/2022 15:16:45",,"0"
"89","9","1","1995","2022","","CONCEDE SUBVENÇÃO SOCIAL A ASSOCIAÇÃO DE APRENDIZAGEM E CIDADANIA DE FRONTEIRA-MG (GUARDA MIRIM DE FRONTEIRA – GMF) E DÁ OUTRAS PROVIDÊNCIAS.",,"11/2/2022 15:19:15","11/2/2022 15:19:15",,"0"
"90","1","1","6386","2022","","ALTERA O CALENDÁRIO OFICIAL DE FERIADOS E PONTOS FACULTATIVOS PARA O EXERCÍCIO DE 2022 NO MUNICÍPIO DE FRONTEIRA",,"22/2/2022 16:31:49","22/2/2022 16:31:49",,"0"
"91","13","1","6387","2022","","DISPÕE SOBRE A REVOGAÇÃO DE ATO NORMATIVO SOBRE MEDIDAS SANITÁRIAS ACERCA DA PANDEMIA DE COVID-19 ",,"24/2/2022 15:44:24","24/2/2022 15:44:24",,"0"
"92","9","1","1996","2022","","CONCEDE SUBVENÇÃO SOCIAL AO SINDICATO RURAL DE FRONTEIRA E DÁ OUTRAS PROVIDÊNCIAS.",,"14/3/2022 13:18:24","14/3/2022 13:18:24",,"0"
"93","9","1","1997","2022","","DISPÕE SOBRE A ABERTURA DE CRÉDITO ADICIONAL ESPECIAL NO ORÇAMENTO VIGENTE PARA A INCLUSÃO DE AÇÃO EM PROGRAMA DO PPA, LDO e LOA E DÁ OUTRAS PROVIDÊNCIAS",,"14/3/2022 13:19:56","14/3/2022 13:19:56",,"0"
"94","9","1","1998","2022","","AUTORIZA A ALIENAÇÃO DE BENS MÓVEIS E DÁ OUTRAS PROVIDÊNCIAS.",,"14/3/2022 13:23:59","14/3/2022 13:23:59",,"0"
"95","13","1","6407","2022","","DISPÕE SOBRE A REVOGAÇÃO DE ATO NORMATIVO REFERENTE ÀS MEDIDAS SANITÁRIAS ACERCA DA PANDEMIA COVID-19;",,"30/3/2022 13:25:25","30/3/2022 13:25:25",,"0"
"96","13","1","6409","2022","","DISPÕE SOBRE A UTILIZAÇÃO DE MÁSCARAS NA UNIDADE MISTA DE SAÚDE (UMS) E UNIDADES DE ESTRATÉGIA SAÚDE DA FAMÍLIA (ESF) DURANTE A PANDEMIA DE COVID-19",,"1/4/2022 15:15:26","1/4/2022 15:15:26",,"0"
"97","9","1","1999","2022","","AUTORIZA O PODER EXECUTIVO MUNICIPAL A PROMOVER PROCESSO DE TRANSFERENCIA DE IMÓVEIS NA FORMA QUE MENCIONA E DA OUTRAS PROVIDÊNCIAS;",,"1/4/2022 15:49:41","1/4/2022 15:49:41",,"0"
"98","9","1","2000","2022","","AUTORIZA A CONCESSÃO DE REPASSES FINANCEIROS AS CAIXAS ESCOLARES DO MUNICÍPIO PARA O EXERCÍCIO DE 2022 E DA OUTRAS PROVIDÊNCIAS;",,"1/4/2022 15:50:23","1/4/2022 15:50:23",,"0"
"99","9","1","2001","2022","","ALTERA NO ART 1º DA LEI Nº 1.997/2022, O CÓDIGO DA FONTE DE RECURSOS E DESCRIÇÃO NO QUADRO DE CRIAÇÃO DE NOVA DOTAÇÃO ORÇAMENTÁRIA E DA OUTRAS PROVIDÊNCIAS;",,"1/4/2022 15:51:25","1/4/2022 15:51:25",,"0"
"100","13","1","5846","2021","","DECLARA ESTADO DE CALAMIDADE PÚBLICA NO MUNICÍPIO DE FRONTEIRA EM DECORRÊNCIA DA PANDEMIA DE COVID-19",,"18/4/2022 14:01:12","18/4/2022 14:01:12",,"0"
"101","13","1","6085","2021","","AMPLIA O PERÍODO DE DECLARAÇÃO DE ESTADO DE CALAMIDADE PÚBLICA NO MUNICÍPIO DE FRONTEIRA EM DECORRÊNCIA DA PANDEMIA DE COVID-19.",,"18/4/2022 14:06:49","18/4/2022 14:06:49",,"0"
"102","3","1","0002","2022","","AUTORIZA A RECOMPOSIÇÃO DA BASE REMUNERATÓRIA DOS AGENTES PÚBLICOS DO MUNICÍPIO DE FRONTEIRA.",,"26/4/2022 13:57:30","26/4/2022 13:57:30",,"0"
"103","3","1","0003","2022","","DISPÕE SOBRE A CONVALIDAÇÃO DA LEI Nº 1.879, DE 19 DE NOVEMBRO DE 2019 E DÁ OUTRAS PROVIDÊNCIAS.",,"26/4/2022 13:59:33","26/4/2022 13:59:33",,"0"
"104","9","1","2003","2022","","INSTITUI NO MUNICÍPIO DE FRONTEIRA O PRÊMIO ALUNO ESPORTISTA DO ANO E DÁ OUTRAS PROVIDÊNCIAS.",,"26/4/2022 14:01:09","26/4/2022 14:01:09",,"0"
"105","9","1","2002","2022","","INSTITUI O PROGRAMA “MEDICAMENTO EM CASA” NO MUNICÍPIO E DÁ OUTRAS PROVIDÊNCIAS",,"26/4/2022 14:03:02","26/4/2022 14:03:02",,"0"
"106","1","1","6446","2022","","Declara de Utilidade Pública, imóvel urbano, para fins de abertura de ruas em área urbana para acesso a imóvel Público.",,"18/5/2022 13:38:04","18/5/2022 13:42:27",,"0"
"107","1","1","6447","2022","","FIXA PRAZO PARA PRÁTICA DOS ATOS DOS ÓRGÃOS DESTE MUNICIPIO, E DÁ OUTRAS PROVIDÊNCIAS.",,"18/5/2022 14:06:34","18/5/2022 14:06:34",,"0"
"108","1","1","6448","2022","","ALTERA DECRETO 6293, REFERENTE CRONOGRAMA DE VENCIMENTO IPTU EXERCÍCIO 2022 - MUNICIPIO FRONTEIRA MG.",,"18/5/2022 14:09:47","18/5/2022 14:09:47",,"0"
"109","9","1","2004","2022","","DISPÕE SOBRE A INSTITUIÇÃO DA COMISSÃO INTERNA DE PREVENÇÃO DE ACIDENTES - CIPA  NO ÂMBITO DO MUNICIPIO DE FRONTEIRA MG E DÁ OUTRAS PROVIDÊNCIAS.",,"18/5/2022 14:14:09","18/5/2022 14:14:09",,"0"
"111","3","2","0004","2022","","REVOGA LEI COMPLEMENTAR 002 DE 09 DE JUNHO DE 2021 E DÁ OUTRAS PROVIDÊNCIAS.",,"18/5/2022 14:24:19","18/5/2022 14:24:19",,"0"
"112","1","1","6455","2022","","INSTITUI, NOMEIA E EMPOSSA OS MEMBROS DO COMITÊ TÉCNICO MUNICIPAL DE PROMOÇÃO DA EQUIDADE EM SAÚDE E DÁ OUTRAS PROVIDÊNCIAS.",,"24/5/2022 15:09:55","24/5/2022 15:11:54",,"0"
"113","1","1","6452","2022","","INSTITUI AS COMISSÕES DE DESENVOLVIMENTO FUNCIONAL E A COMISSÃO DE REVISÃO DE DESEMPENHO PARA EFEITO DE AVALIAÇÃO DE DESENVOLVIMENTO FUNCIONAL DOS SERVIDORES DA SECRETARIA MUNICIPAL DE EDUCAÇÃO E DÁ OUTRAS PROVIDÊNCIAS.",,"2/6/2022 14:19:58","2/6/2022 14:19:58",,"0"
"114","1","1","6456","2022","","NOMEIA E EMPOSSA MEMBROS DO CONSELHO ASSISTÊNCIA SOCIAL.",,"7/6/2022 15:59:28","7/6/2022 15:59:28",,"0"
"115","9","1","2006","2022","","AUTORIZA O MUNICÍPIO DE FRONTEIRA A CONTRATAR COM O BANCO DE DESENVOLVIMENTO DE MINAS GERIAS S/A - BDMG, OPERAÇÕES DE CRÉDITO COM OUTORGA DE GARANTIA E DÁ OUTRAS PROVIDÊNCIAS.",,"21/6/2022 13:36:27","21/6/2022 13:38:34",,"0"
"116","9","1","2007","2022","","AUTORIZA O PODER EXECUTIVO A PREMIAR OS VENCEDORES DOS EVENTOS ESPORTIVOS E CULTURAIS MUNICIPAIS NA FORMA MENCIONADA E DÁ OUTRAS PROVIDÊNCIAS.",,"21/6/2022 13:40:19","21/6/2022 13:40:19",,"0"
"117","1","1","6475","2022","","DISPÓE SOBRE A NOMEAÇÃO E POSSE DOS MEBROS DO COMITÊ DIRETOR DO PLANO MUNICIPAL DE GESTÃO INTEGRADA DE RESIDUOS SOLIDOS - PMGIRS DE FRONTEIRA -MG, E DÁ OUTRAS PROVIDÊNCIAS.",,"21/6/2022 13:43:53","21/6/2022 13:43:53",,"0"
"118","1","1","6483","2022","","DISPÕE SOBRE A CRIAÇÃO DO CONSELHO MUNICIPAL DE CONTROLE SOCIAL DE SANEAMENTO BÁSICO NO ÂMBITO DO MUNICIPIO DE FRONTEIRA MG E DÁ OUTRAS PROVIDÊNCIAS.",,"27/6/2022 16:00:15","27/6/2022 16:00:15",,"0"
"119","11","1","7089","2022","","NOMEIA A COMISSÃO DE PROCESSO ADMINISTRATIVO DISCIPLINAR, REGULAMENTANDO O TRABALHO DA COMISSÃO CONFORME DISPÕE DECRETO 5.810 DE 01-01-2021.",,"27/6/2022 16:05:16","27/6/2022 16:05:16",,"0"
"120","9","1","2008","2022","","DISPÕE SOBRE A ABERTURA DE CRÉDITO ADICIONAL SUPLEMENTAR NO ORÇAMENTO VIGENTE E DÁ OUTRAS PROVIDÊNCIAS.",,"27/6/2022 16:07:35","27/6/2022 16:07:35",,"0"
"121","1","1","6486","2022","","ALTERA  O CRONOGRAMA DE VENCIMENTO DO IPTU (IMPOSTO PREDIAL E TERRITORIAL URBANO), DO EXERCICIO 2022 DO MUNICÍPIO DE FRONTEIRA E REVOGA O DECRETO 6.293 DE 17 DE DEZEMBRO DE 2021.",,"7/7/2022 14:12:53","7/7/2022 14:12:53",,"0"
"123","9","1","2009","2022","","DISPÕE SOBRE ABERTURA DE CRÉDITO ADICIONAL ESPECIAL NO ORÇAMENTO VIGENTE PARA A INCLUSÃO DE AÇÃO EM PROGRAMA DO PPA, LDO E LOA E DÁ OUTRAS PROVIDÊNCIAS.",,"28/7/2022 08:25:23","28/7/2022 08:25:23",,"0"
"124","9","1","2010","2022","","NOVA DENOMINAÇÃO DA AVENIDA DOS ESPORTES",,"2/8/2022 10:56:09","2/8/2022 10:56:09",,"0"
"125","11","1","7093","2022","","NOMEIA COMISSÃO DE PROCESSO ADM DISCIPLINAR, REGULAMENTANDO O TRABALHO DA COMISSÃO CONFORME DISPÕE DECRETO 5.810.",,"2/8/2022 10:59:21","2/8/2022 10:59:21",,"0"
"126","11","1","7095","2022","","ALTERA PORTARIA 6.995 - DESIGNA SERVIDOR MUNICIPAL RESPONSÁVEL CADASTRAMENTO UMC-INCRA",,"18/8/2022 10:14:07","18/8/2022 10:14:07",,"0"
"127","11","1","7090","2022","","NOMEIA NAGILA MEZADRE - AGENTE DESENVOLVIMENTO SEBRAE",,"18/8/2022 10:17:03","18/8/2022 10:17:03",,"0"
"128","11","1","7096","2022","","DESIGNA SERVIDOR EXERCER FUNÇÃO AGENTE DESENVOLVIMENTO SEBRAE",,"18/8/2022 10:18:57","18/8/2022 10:18:57",,"0"
"130","3","1","0006","2022","","SOBRE PISO SALARIAL AGENTES DE COMBATE ÀS  ENDEMIAS E AGENTES COMUNITÁRIOS",,"18/8/2022 10:23:29","18/8/2022 10:23:29",,"0"
"131","9","1","1970","2021","","INCLUI PERÍMETRO URBANO NO MUNICÍPIO A ÁREA QUE MENCIONA.",,"18/8/2022 15:57:06","18/8/2022 15:57:06",,"0"
"132","3","1","0005","2022","","Lei seis horas",,"25/8/2022 08:36:48","25/8/2022 08:36:48",,"0"
"136","9","1","2012","2022","","DISPÓE SOBRE ABERTURA DE CRÉDITO ADICIONAL SUPLEMENTAR NO ORÇAMENTO E DÁ OUTRAS PROVIDÊNCIAS.",,"31/8/2022 08:30:33","31/8/2022 08:30:33",,"0"
"137","9","1","2013","2022","","DISPÓE SOBRE ABERTURA DE CRÉDITO ADICIONAL SUPLEMENTAR NO ORÇAMENTO E DÁ OUTRAS PROVIDÊNCIAS.",,"31/8/2022 08:33:05","31/8/2022 08:33:05",,"0"
"138","9","1","2014","2022","","DISPÓE SOBRE ABERTURA DE CRÉDITO ADICIONAL SUPLEMENTAR NO ORÇAMENTO E DÁ OUTRAS PROVIDÊNCIAS.",,"31/8/2022 08:36:43","31/8/2022 08:36:43",,"0"
