"id","idCategoriaLegislacao","idStatusLegislacao","numero","ano","link","sumula","nomeArquivo","created_at","updated_at","nome","remoto"
"303","1","1","7018","2023","","DISPÕE SOBRE A INCLUSÃO DE EVENTO NO CALENDÁRIO DE EVENTOS OFICIAL DO MUNICÍPIO DE FRONTEIRA-MG E DÁ OUTRAS PROVIDÊNCIAS.",,"18/8/2023 08:40:33","18/8/2023 08:40:33",,"0"
"305","1","1","7024","2023","","SUSPENDE O EXPEDIENTE NO MUNICÍPIO DE FRONTEIRA-MG E DÁ OUTRAS PROVIDÊNCIAS.",,"31/8/2023 09:00:08","31/8/2023 09:00:08",,"0"
"306","9","1","2060","2023","","AUTORIZA A CONCESSÃO DE SUBVENÇÃO SOCIAL AO CONSELHO COMUNITÁRIO DE SEGURANÇA PÚBLICA E SOCIAL DE FRONTEIRA-MG (CONSEP) E DÁ OUTRAS PROVIDÊNCIAS.",,"31/8/2023 09:08:19","31/8/2023 09:08:19",,"0"
"310","3","1","0007","2023","","DISPÕE SOBRE O SISTEMA MUNICIPAL DE CULTURA DO MUNICÍPIO DE FRONTEIRA-MG E DÁ OUTRAS PROVIDÊNCIAS.",,"31/8/2023 09:14:27","31/8/2023 09:14:27",,"0"
"311","9","1","2063","2023","","DISPÕE SOBRE POLÍTICA PÚBLICA MUNICIPAL PARA GARANTIA, PROTEÇÃO E AMPLIAÇÃO DOS DIREITOS DAS PESSOAS COM TRANSTORNO DO ESPECTRO AUTISTA (TEA) E SEUS FAMILIARES.",,"31/8/2023 09:17:27","31/8/2023 09:17:27",,"0"
"312","9","1","2062","2023","","
DA DENOMINAÇÃO A RUA 17 NA VILA CHICA DE “JOSEFA MARIA GOMES” E 
DÁ OUTRAS PROVIDÊNCIAS.",,"31/8/2023 09:19:00","31/8/2023 09:19:00",,"0"
"313","9","1","2064","2023","","DISPÕE SOBRE A RESERVA DE VAGAS PARA PESSOA COM DEFICIÊNCIA (PCD) NOS PROCESSOS SELETIVOS DOS PODERES LEGISLATIVO E EXECUTIVO NO MUNICÍPIO DE FRONTEIRA, ESTADO DE MINAS GERAIS",,"31/8/2023 09:20:06","31/8/2023 09:20:06",,"0"
"314","9","1","2061","2023","","ALTERA O ART 1º DA LEI Nº 1.961 DE 12 DE AGOSTO DE 2021, COM A ADEQUAÇÃO DA DENOMINAÇÃO DA CRECHE “DONA ALICE” PARA CENTRO MUNICIPAL DE EDUCAÇÃO INFANTIL (CMEI) “DONA ALICE” E RETIFICAÇÃO DA NUMERAÇÃO.",,"31/8/2023 09:23:50","31/8/2023 09:23:50",,"0"
"315","1","1","7025","2023","","DISPÕE SOBRE APROVAÇÃO DE LOTEAMENTO DENOMINADO “VALE DO SOL” E DÁ OUTRAS PROVIDÊNCIAS.",,"1/9/2023 09:45:29","1/9/2023 09:45:29",,"0"
"316","3","1","0008","2023","","DISPÕE SOBRE O PISO SALARIAL DOS ENFERMEIROS, DOS TÉCNICOS DE ENFERMAGEM E DOS AUXILIARES DE ENFERMAGEM, SERVIDORES DA ADMINISTRAÇÃO PÚBLICA DIRETA.",,"19/9/2023 10:24:21","19/9/2023 10:24:21",,"0"
"317","9","1","2066","2023","","DISPÕE SOBRE A MODIFICAÇÃO DO INCISO I DO ART. 4° DA LEI MUNICIPAL N° 2.045, DE 20 DE DEZEMBRO DE 2022, E DA OUTRAS PROVIDÊNCIAS.",,"20/9/2023 09:05:12","20/9/2023 09:05:12",,"0"
"318","1","1","7043","2023","","“Coloca à disposição da Comissão Eleitoral do Conselho Municipal dos Direitos da Criança e do Adolescente (CMDCA), servidores públicos de todas as Secretarias Municipais, e dependências dos estabelecimentos da Rede Municipal de Ensino, com vistas à realização do pleito facultativo, de 1º de outubro de 2023, para escolha dos conselheiros tutelares de Fronteira, e dá outras providências”",,"28/9/2023 14:12:52","28/9/2023 14:12:52",,"0"
"319","9","1","2067","2023","","DISPÕE SOBRE AS DIRETRIZES PARA ELABORAÇÃO E EXECUÇÃO DA LEI ORÇAMENTÁRIA PARA O EXERCÍCIO FINANCEIRO DO ANO DE 2024, E DÁ OUTRAS PROVIDÊNCIAS.",,"4/10/2023 15:18:33","4/10/2023 15:18:33",,"0"
"320","1","1","7053","2023","","DISPÕE SOBRE A INCLUSÃO DE EVENTOS NO CALENDÁRIO DE EVENTOS OFICIAL DO MUNICÍPIO DE FRONTEIRA-MG, E DÁ OUTRAS PROVIDÊNCIAS.",,"5/10/2023 16:05:26","5/10/2023 16:05:26",,"0"
"321","1","1","7052","2023","","DISPÕE SOBRE A INCLUSÃO DE EVENTOS NO CALENDÁRIO DE EVENTOS OFICIAL DO MUNICÍPIO DE FRONTEIRA-MG, E DÁ OUTRAS PROVIDÊNCIAS.",,"5/10/2023 16:07:03","5/10/2023 16:07:03",,"0"
"322","1","1","7055","2023","","DISPÕE SOBRE A AUTORIZAÇÃO
DE USO DE LOGRADOUROS
PÚBLICOS, COM O FECHAMENTO
PARCIAL DAS RUAS DESCRITAS,
NAS SEXTAS-FEIRAS, SÁBADOS E
FERIADOS, NOS HORÁRIOS
COMPREENDIDOS ENTRE ÀS 18H E
ÀS 6H E DÁ OUTRAS
PROVIDÊNCIAS.",,"10/10/2023 14:31:29","10/10/2023 14:31:29",,"0"
"323","1","1","7057","2023","","CONSOLIDA O CALENDÁRIO OFICIAL DE FERIADOS E PONTOS FACULTATIVOS DO ANO DE 2023 DO MUNICÍPIO DE FRONTEIRA/MG.",,"18/10/2023 13:25:55","18/10/2023 13:25:55",,"0"
"324","9","1","1477","2010","","Dispõe sobre o Plano de Cargos, Carreiras e Vencimentos dos servidores da Área de Educação do Poder Executivo do Município de Fronteira e dá outras providências",,"24/10/2023 15:41:49","24/10/2023 15:41:49",,"0"
"325","10","1","0000","0000","","DOCUMENTO CURRICULAR DA REDE MUNICIPAL DE ENSINO DE FRONTEIRA MG",,"24/10/2023 16:15:22","24/10/2023 16:15:22",,"0"
"326","9","1","1689","2015","","APROVA O PLANO DECENAL MUNICIPAL DE EDUCAÇÃO DE FRONTEIRA – PDMEF -PARA O DECÊNIO 2015/2024 E DÁ OUTRAS PROVIDÊNCIAS.",,"24/10/2023 16:35:35","24/10/2023 16:35:35",,"0"
"327","1","1","7058","2023","","Altera o Decreto Municipal n.º 6.902 de 15 de março de 2023",,"6/11/2023 15:37:25","6/11/2023 15:37:25",,"0"
"328","1","1","7067","2023","","DECLARA ÁREA DE UTILIDADE PÚBLICA PARA FINS DE DESAPROPRIAÇÃO",,"7/11/2023 09:23:05","7/11/2023 09:23:05",,"0"
"329","9","1","2065","2023","","DA DENOMINAÇÃO A AVENIDA DA MATRIZ – CENTRO DE “NELSON GONÇALVES COSTA” E DÁ OUTRAS PROVIDÊNCIAS.",,"7/11/2023 15:56:14","7/11/2023 15:56:14",,"0"
"330","9","1","2068","2023","","DA DENOMINAÇÃO A RUA DOS LIRIOS, NO BAIRRO ASSIS SIMPLICIO DE “TEREZINHA TARGINO DA SILVA” E DÁ OUTRAS PROVIDÊNCIAS.",,"7/11/2023 15:57:22","7/11/2023 15:57:22",,"0"
"332","9","1","2069","2023","","AUTORIZA O PODER EXECUTIVO MUNICIPAL A PROMOVER PROCESSO DE TRANSFERÊNCIA DE IMÓVEIS NA FORMA QUE MENCIONA E DÁ OUTRAS PROVIDÊNCIAS.",,"29/11/2023 16:37:59","29/11/2023 16:37:59",,"0"
"333","1","1","7173","2024","","ABRE CREDITO SUPLEMENTAR POR SUPERAVIT FINANCEIRO PARA REFORÇO DE DOTAÇÕES ORÇAMENTARIAS",,"25/1/2024 09:29:56","25/1/2024 09:29:56",,"0"
"334","1","1","7197","2024","","PRORROGA OS PRAZOS PREVISTOS NO ARTIGO 1º, DA LEI COMPLEMENTAR Nº 011, DE 15 DEZEMBRO DE 2023.",,"4/3/2024 09:50:17","4/3/2024 09:50:17",,"0"
"335","1","1","7183","2024","","APROVA O CALENDÁRIO OFICIAL DE FERIADOS E PONTOS FACULTATIVOS PARA O EXERCÍCIO DE 2024 NO MUNICÍPIO DE FRONTEIRA.",,"4/3/2024 09:56:06","4/3/2024 09:56:06",,"0"
"336","1","1","7079","2023","","INSTITUI A COMISSÃO DA LEI PAULO GUSTAVO",,"4/3/2024 10:09:31","4/3/2024 10:09:31",,"0"
"337","1","1","7160","2023","","ESTABELECE HORÁRIOS ESPECIAIS DE ATENDIMENTO AO PÚBLICO E FUNCIONAMENTO DAS SECRETARIAS E ÓRGÃOS MUNICIPAIS E DÁ OUTRAS PROVIDÊNCIAS.",,"4/3/2024 10:11:17","4/3/2024 10:11:17",,"0"
"338","1","1","7091","2023","","AUTORIZA A ADOÇÃO DE MEDIDAS E TOMADA DE DECISÕES PELA COMISSÃO DE SELEÇÃO DE PROJETOS DE EXECUÇÃO CULTURAL COM RECURSOS DA LEI PAULO GUSTAVO",,"4/3/2024 10:31:09","4/3/2024 10:31:09",,"0"
"339","9","1","2078","2024","","ALTERA O INCISO III DO ART. 1º, DA LEI MUNICIPAL Nº 2.072, DE 14 DE DEZEMBRO DE 2023 E DÁ OUTRAS PROVIDÊNCIAS.",,"4/3/2024 10:45:07","4/3/2024 10:45:07",,"0"
"340","9","1","2075","2024","","DISPÕE SOBRE A AUTORIZAÇÃO DE PERCENTUAL PARA REALOCAÇÕES DE SALDOS DE DOTAÇÕES ORÇAMENTÁRIAS DO ORÇAMENTO PARA O EXERCÍCIO DE 2024 E CONTÉM OUTRAS PROVIDÊNCIAS.",,"4/3/2024 10:50:52","4/3/2024 10:50:52",,"0"
"342","9","1","2077","2024","","DISPÕE SOBRE A POLÍTICA MUNICIPAL DE ATENDIMENTO DOS DIREITOS DA CRIANÇA E DO ADOLESCENTE, REGULAMENTA O CONSELHO MUNICIPAL DOS DIREITOS DA CRIANÇA E DO ADOLESCENTE (CMDCA) E INSTITUI O FUNDO MUNICIPAL DOS DIREITOS DA CRIANÇA E DO ADOLESCENTE (FMDCA) E DÁ OUTRAS PROVIDÊNCIAS.",,"4/3/2024 10:54:28","4/3/2024 10:54:28",,"0"
"343","9","1","2079","2024","","DISPÕE SOBRE A CRIAÇÃO DO CONSELHO MUNICIPAL DE DIREITOS DO IDOSO (CMDI), INSTITUI O FUNDO MUNICIPAL DE DIREITOS DO IDOSO E DÁ OUTRAS PROVIDÊNCIAS.",,"4/3/2024 10:59:35","4/3/2024 10:59:35",,"0"
"344","3","1","0009","2023","","DISPÕE SOBRE A CRIAÇÃO DO PROGRAMA DE DESENVOLVIMENTO ECONÔMICO DO MUNICÍPIO DE FRONTEIRA, TRATA DA CONCESSÃO DE INCENTIVOS FISCAIS E ESTÍMULOS ECONÔMICOS E DÁ OUTRAS PROVIDÊNCIAS.",,"4/3/2024 11:02:00","4/3/2024 11:02:00",,"0"
"345","3","1","0010","2023","","DISPÕE SOBRE A CONTRIBUIÇÃO PARA CUSTEIO DO SERVIÇO DE ILUMINAÇÃO PÚBLICA E DÁ OUTRAS PROVIDÊNCIAS.",,"4/3/2024 13:05:20","4/3/2024 13:05:20",,"0"
"346","3","1","0011","2023","","INSTITUI PROGRAMA DE RECUPERAÇÃO FISCAL (REFIS) PARA O ANO DE 2024 E AUTORIZA O PODER EXECUTIVO MUNICIPAL A CONCEDER DESCONTO SOBRE OS JUROS E AS MULTAS DOS TRIBUTOS MUNICIPAIS NO EXERCÍCIO DE 2024 E DÁ OUTRAS PROVIDÊNCIAS.",,"4/3/2024 13:07:15","4/3/2024 13:07:15",,"0"
"347","9","1","2070","2023","","DISPÕE SOBRE A MODIFICAÇÃO DO INCISO I DO ART. 4º DA LEI MUNICIPAL N.º 2.045, DE 20 DE DEZEMBRO DE 2022 E ALTERAÇÃO DO INCISO I DO ART. 10º E DO ART. 11º DA LEI MUNICIPAL N.º 2.020, DE 14 DE SETEMBRO DE 2022, E DA OUTRAS PROVIDÊNCIAS.",,"4/3/2024 13:08:37","4/3/2024 13:11:40",,"0"
"348","9","1","2071","2023","","AUTORIZA O PODER EXECUTIVO CONCEDER AUXÍLIO-MORADIA E AUXÍLIO-ALIMENTAÇÃO AOS MÉDICOS VINCULADOS AO PROGRAMA MAIS MÉDICOS PELO BRASIL E DÁ OUTRAS PROVIDÊNCIAS.",,"4/3/2024 13:09:53","4/3/2024 13:09:53",,"0"
"349","9","1","2072","2023","","AUTORIZA A CONCESSÃO DE CUSTEIO E/OU SUBVENÇÃO SOCIAL ÀS ASSOCIAÇÕES, ENTIDADES FILANTRÓPICAS E SINDICATOS QUE SE MENCIONA E DÁ OUTRAS PROVIDÊNCIAS.",,"4/3/2024 13:12:26","4/3/2024 13:12:26",,"0"
"350","9","1","2073","2023","","DISPÕE SOBRE A CONCESSÃO DE VERBAS INDENIZATÓRIAS NO ÂMBITO DO PODER LEGISLATIVO MUNICIPAL.",,"4/3/2024 13:13:30","4/3/2024 13:13:30",,"0"
"351","9","1","2074","2023","","ESTIMA A RECEITA E FIXA A DESPESA DO MUNICÍPIO DE FRONTEIRA PARA O EXERCÍCIO DE 2024",,"4/3/2024 13:15:25","4/3/2024 13:15:25",,"0"
"352","1","1","7226","2024","","AUTORIZA A PERMISSÃO DE USO DE BENS MÓVEIS QUE MENCIONA E DÁ OUTRAS PROVIDÊNCIAS. (FICA AUTORIZADO A ASSOCIAÇÃO DOS ARTESÃOS DE FRONTEIRA)",,"4/3/2024 13:51:32","4/3/2024 13:55:16",,"0"
"353","1","1","7225","2024","","AUTORIZA A PERMISSÃO DE USO DE BENS MÓVEIS QUE MENCIONA E DÁ OUTRAS PROVIDÊNCIAS. (FICA AUTORIZADO AO ACAMPAMENTO BOM JESUS-ACBJ)",,"4/3/2024 13:54:00","4/3/2024 13:54:00",,"0"
"354","1","1","7224","2024","","DISPÕE SOBRE A DELEGAÇÃO DE PODERES AO GESTOR MUNICIPAL DE SAÚDE PARA DESIGNAR DIRETORES CLÍNICOS E RESPONSÁVEIS TÉCNICOS PARA AS UNIDADES DE SAÚDE DO MUNICÍPIO E DÁ OUTRAS PROVIDÊNCIAS.",,"4/3/2024 13:57:04","4/3/2024 13:57:04",,"0"
"355","1","1","7181","2023","","NOMEIA SERVIDORES PARA A FUNÇÃO DE PREGOEIRO E EQUIPE DE APOIO, DE QUE TRATA A LEI FEDERAL Nº 14.133/2021 E O DECRETO Nº 6.956/2023 E DÁ OUTRAS PROVIDÊNCIAS.",,"4/3/2024 14:00:15","4/3/2024 14:00:15",,"0"
"356","1","1","7180","2024","","NOMEIA SERVIDORES PARA A FUNÇÃO DE AGENTE DE CONTRATAÇÃO E EQUIPE DE APOIO, DE QUE TRATA A LEI FEDERAL Nº 14.133/2021 E O DECRETO Nº 6.956/2023 E DÁ OUTRAS PROVIDÊNCIAS.",,"4/3/2024 14:01:27","4/3/2024 14:01:27",,"0"
"357","1","1","7179","2024","","NOMEIA SERVIDORES PARA COMPOREM A COMISSÃO DE PREGÃO PRESENCIAL E ELETRÔNICO, DE QUE TRATAM O DECRETO Nº 5.994/2021 E DÁ OUTRAS PROVIDÊNCIAS.",,"4/3/2024 14:02:30","4/3/2024 14:02:30",,"0"
"358","1","1","7178","2024","","NOMEIA SERVIDORES PARA COMPOREM A COMISSÃO PERMANENTE DE LICITAÇÃO.",,"4/3/2024 14:07:51","4/3/2024 14:07:51",,"0"
"359","1","1","7195","2024","","DESIGNA SERVIDORES PARA COMPOREM A COMISSÃO DE PROCESSO ADMINISTRATIVO SANCIONADOR, DE QUE TRATAM ÀS LEIS FEDERAIS Nº 8.666/1993 E 14.133/2021 E DÁ OUTRAS PROVIDÊNCIAS.",,"4/3/2024 14:31:10","4/3/2024 14:31:10",,"0"
"360","1","1","7194","2024","","AUTORIZA A PERMISSÃO DE USO DE BENS MÓVEIS QUE MENCIONA E DÁ OUTRAS PROVIDÊNCIAS.",,"4/3/2024 14:32:44","4/3/2024 14:32:44",,"0"
"361","1","1","7279","2024","","DECLARA LUTO OFICIAL NO MUNICÍPIO DE FRONTEIRA-MG EM RAZÃO DO FALECIMENTO DA SENHORA AMAL SIMBOLE CAMPOS E DÁ OUTRAS PROVIDÊNCIAS.",,"5/3/2024 09:45:39","5/3/2024 09:46:52",,"0"
"362","1","1","7280","2024","","DECLARA SUSPENSÃO DO EXPEDIENTE DA SECRETARIA MUNICIPAL DE ASSISTÊNCIA SOCIAL E PROMOÇÃO HUMANA/FMAS EM RAZÃO DO FALECIMENTO DA GESTORA SENHORA AMAL SIMBOLE CAMPOS E DÁ OUTRAS PROVIDÊNCIAS.",,"6/3/2024 08:54:54","6/3/2024 08:54:54",,"0"
"363","1","1","7235","2024","","REVOGA O DECRETO Nº 4.244, DE 1º DE ABRIL DE 2019 E ALTERA O DECRETO Nº 3.785, DE 27 DE AGOSTO DE 2018, QUE DISPÕE SOBRE O REGIME DE ADIANTAMENTOS E REEMBOLSOS DE VIAGENS PARA SERVIDORES OCUPANTES DO CARGOS DE MOTORISTA E CONTÉM OUTRAS PROVIDÊNCIAS.",,"7/3/2024 14:54:37","7/3/2024 14:54:37",,"0"
"364","1","1","7285","2024","","DISPÕE SOBRE APROVAÇÃO DE LOTEAMENTO DENOMINADO “MARINAS NÁUTICO RESIDENCE 3” E DÁ OUTRAS PROVIDÊNCIAS.",,"11/3/2024 16:42:48","11/3/2024 16:42:48",,"0"
"365","1","1","7286","2024","","DECLARA DE UTILIDADE PÚBLICA, PARA FINS DE DESAPROPRIAÇÃO DE PLENO DOMÍNIO E CONSTITUIÇÃO DE SERVIDÃO, PELA COMPANHIA DE SANEAMENTO DE MINAS GERAIS – COPASA MG, IMÓVEIS NECESSÁRIOS AOS SISTEMAS DE ESGOTAMENTO SANITÁRIO E ABASTECIMENTO DE ÁGUA DO MUNICÍPIO DE FRONTEIRA/MG E DÁ OUTRAS PROVIDÊNCIAS.",,"11/3/2024 16:43:49","11/3/2024 16:43:49",,"0"
"366","1","1","7287","2024","","AUTORIZA A PERMISSÃO DE USO DE BENS MÓVEIS QUE MENCIONA E DÁ OUTRAS PROVIDÊNCIAS.",,"11/3/2024 16:45:01","11/3/2024 16:45:01",,"0"
"367","9","1","2080","2024","","INCLUI NO PERÍMETRO URBANO DO MUNICÍPIO A ÁREA QUE MENCIONA E DÁ OUTRAS PROVIDÊNCIAS.",,"13/3/2024 13:47:06","13/3/2024 13:47:06",,"0"
"368","9","1","2081","2024","","INSTITUI NO MUNICÍPIO DE FRONTEIRA-MG, O PROGRAMA “VARAL SOLIDÁRIO” E DÁ OUTRAS PROVIDÊNCIAS.",,"13/3/2024 13:47:56","13/3/2024 13:47:56",,"0"
"369","9","1","2082","2024","","ALTERA O INCISO VII DO ART 1° DA LEI MUNICIPAL N°  2.072 DE 14 DE DEZEMBRO DE 2023 - FREI ODORICO VIRGA ASSINADA",,"20/3/2024 09:28:42","20/3/2024 09:28:42",,"0"
"370","1","1","7300","2024","","DISPÕE SOBRE A IMPLANTAÇÃO DA POLÍTICA DE EDUCAÇÃO INTEGRAL NA REDE MUNICIPAL DE ENSINO DE FRONTEIRA E REIMPLEMENTAÇÃO DA ESCOLA EM TEMPO INTEGRAL DA ESCOLA MUNICIPAL POLIANA ZIZA FERREIRA E DÁ OUTRAS PROVIDÊNCIAS",,"20/3/2024 14:05:05","20/3/2024 14:05:05",,"0"
"372","1","1","7234","2024","","NOMEIA SERVIDORES PARA A FUNÇÃO DE AGENTE DE CONTRATAÇÃO E EQUIPE DE APOIO, DE QUE TRATA A LEI FEDERAL Nº 14.133/2021 E O DECRETO Nº 6.956/2023 E DÁ OUTRAS PROVIDÊNCIAS.",,"25/3/2024 13:54:19","25/3/2024 13:54:19",,"0"
"376","1","1","7304","2024","","ALTERA E CONSOLIDA O CALENDÁRIO OFICIAL DE FERIADOS E PONTOS FACULTATIVOS PARA O EXERCÍCIO DE 2024 NO MUNICÍPIO DE FRONTEIRA",,"25/3/2024 16:52:01","25/3/2024 16:52:01",,"0"
"378","9","1","2083","2024","","AUTORIZA O PODER EXECUTIVO MUNICIPAL A PROMOVER PROCESSO DE TRANSFERÊNCIA DE IMÓVEIS NA FORMA QUE MENCIONA E DÁ OUTRAS PROVIDÊNCIAS.",,"27/3/2024 13:51:41","27/3/2024 13:51:41",,"0"
"379","9","1","2084","2024","","AUTORIZA O MUNICÍPIO DE FRONTEIRA A CONTRATAR COM O BANCO DE DESENVOLVIMENTO DE MINAS GERAIS S/A – BDMG, OPERAÇÕES DE CRÉDITO COM OUTORGA DE GARANTIA E DÁ OUTRAS PROVIDÊNCIAS.",,"27/3/2024 13:53:20","27/3/2024 13:53:20",,"0"
"380","1","1","7323","2024","","ALTERA O CONSELHO MUNICIPAL DE DESENVOLVIMENTO ECONÔMICO SUSTENTÁVEL, E DÁ OUTRAS PROVIDÊNCIAS.",,"3/4/2024 14:49:14","3/4/2024 14:49:14",,"0"
"382","9","1","2076","2024","","CRIA O SERVIÇO DE PROTEÇÃO SOCIAL ESPECIAL DE CUMPRIMENTO DA MEDIDA SOCIOEDUCATIVA E MEIO ABERTO DE LIBERDADE ASSISTIDA (LA) E PRESTAÇÃO DE SERVIÇO À COMUNIDADE (PSC) NO MUNICIPIO DE FRONTEIRA",,"10/4/2024 09:57:59","10/4/2024 09:57:59",,"0"
"383","1","1","7340","2024","","INSTITUI, NOMEIA E EMPOSSA OS MEMBROS DA COMISSÃO INTERSETORIAL DO SERVIÇO DE PROTEÇÃO SOCIAL ESPECIAL DE CUMPRIMENTO DA MEDIDA SOCIOEDUCATIVA EM MEIO ABERTO DE LIBERDADE ASSISTIDA ",,"10/4/2024 10:40:01","10/4/2024 10:40:01",,"0"
"384","1","1","7314","2024","","DISPÕE SOBRE A CRIAÇÃO DA COMISSÃO DE ORGANIZAÇÃO DO CONSELHO MUNICIPAL DE DIREITOS DO IDOSO – CMDI E DÁ OUTRAS PROVIDÊNCIAS.",,"11/4/2024 10:23:05","11/4/2024 10:23:05",,"0"
"386","9","1","2085","2024","","DISPÕE SOBRE A ABERTURA DE CRÉDITO ADICIONAL SUPLEMENTAR NO ORÇAMENTO VIGENTE E DÁ OUTRAS PROVIDÊNCIAS",,"11/4/2024 14:04:39","11/4/2024 14:04:39",,"0"
"387","9","1","2086","2024","","AUTORIZA A CONCESSÃO DE SUBVENÇÃO SOCIAL AO CONSELHO COMUNITÁRIO DE SEGURANÇA PÚBLICA E SOCIAL DE FRONTEIRA-MG (CONSEP) E DÁ OUTRAS PROVIDÊNCIAS.",,"11/4/2024 14:05:40","11/4/2024 14:05:40",,"0"
"388","9","1","2087","2024","","INCLUI NO PERÍMETRO URBANO DO MUNICÍPIO A ÁREA QUE MENCIONA E DÁ OUTRAS PROVIDÊNCIAS.",,"11/4/2024 14:06:52","11/4/2024 14:06:52",,"0"
"389","1","1","7342","2024","","DECRETA LUTO OFICIAL NO MUNICÍPIO DE FRONTEIRA, EM VIRTUDE DO FALECIMENTO DO SR. ECIMAR JOSÉ DE PAULA.",,"12/4/2024 14:54:30","12/4/2024 14:54:30",,"0"
"390","9","1","2088","2024","","DA DENOMINAÇÃO A AVENIDA BRASIL, NO PARQUE FLORIANOPOLIS, NA BEIRA DO RIO GRANDE DE “VILMA DE MOURA POLTROGNERI” E DÁ OUTRAS PROVIDÊNCIAS.",,"15/4/2024 13:26:03","15/4/2024 13:26:03",,"0"
"391","1","1","7343","2024","","AUTORIZA A PERMISSÃO DE USO DE ÁREAS E LOGRADOUROS PÚBLICOS QUE MENCIONAM COM O FECHAMENTO PARCIAL DAS RUAS DESCRITAS, NAS SEXTAS-FEIRAS, SÁBADOS E FERIADOS, NOS HORÁRIOS COMPREENDIDOS ENTRE ÀS 18H E ÀS 6H",,"15/4/2024 16:52:36","15/4/2024 16:52:36",,"0"
"392","1","1","7344","2024","","REGULAMENTA A LEI COMPLEMENTAR Nº 009, DE 14 DE DEZEMBRO DE 2023, QUE DISPÕE SOBRE A CRIAÇÃO DO PROGRAMA DE DESENVOLVIMENTO ECONÔMICO DO MUNICÍPIO DE FRONTEIRA, TRATA DA CONCESSÃO DE INCENTIVOS FISCAIS E ESTÍMULOS ECONÔMICOS, E DÁ OUTRAS PROVIDÊNCIAS.",,"24/4/2024 10:50:52","24/4/2024 10:50:52",,"0"
"393","1","1","7345","2024","","ALTERA O DECRETO Nº 7.304 DE 25 DE MARÇO DE 2024 – ALTERA E CONSOLIDA O CALENDÁRIO OFICIAL DE FERIADOS E PONTOS FACULTATIVOS PARA O EXERCÍCIO DE 2024 NO MUNICÍPIO DE FRONTEIRA.",,"29/4/2024 10:11:08","29/4/2024 10:11:08",,"0"
"395","1","1","7302","2024","","DESAFETA DO DOMÍNIO PÚBLICO OS BENS MÓVEIS QUE ESPECIFICA, DECLARA INSERVÍVEIS À ADMINISTRAÇÃO PÚBLICA E AUTORIZA A DOAÇÃO PARA FINS DE INTERESSE SOCIAL E DÁ OUTRAS PROVIDÊNCIAS.",,"29/4/2024 14:13:27","29/4/2024 14:13:27",,"0"
"398","19","1","0010","2023","","ATA DE REUNIÃO ORDINÁRIA DO CONSELHO MUNICIPAL DOS DIREITOS DA CRIANÇA E DO ADOLESCENTE - CMDCA - GESTÃO 27 DE MARÇO DE 2023 A 23 DE AGOSTO DE 2024",,"6/5/2024 09:33:10","6/5/2024 09:33:10",,"0"
"399","9","1","2090","2024","","DÁ A DENOMINAÇÃO AO CENTRO DE EVENTOS MUNICIPAL NO ENTRONCAMENTO DAS AVENIDAS EMILIANO CORREA COM AVENIDA PROFESSORA SUELI CAROLINA DE LIMA NO BAIRRO VILA ARRUDA DE “Dra. AMAL SIMBOLE CAMPOS” ",,"7/5/2024 13:58:48","7/5/2024 13:58:48",,"0"
"400","9","1","2089","2024","","RATIFICA O PROTOCOLO DE INTENÇÕES CELEBRADO PELOS MUNICÍPIOS VISANDO À INTEGRAÇÃO AO CONSÓRCIO INTERMUNICIPAL DE SAÚDE DO ALTO PARANÁIBA CIS ALP",,"8/5/2024 15:46:06","8/5/2024 15:46:06",,"0"
"401","1","1","7354","2024","","AUTORIZA A PERMISSÃO DE USO DE BENS MÓVEIS QUE MENCIONA E DÁ OUTRAS PROVIDÊNCIAS.",,"9/5/2024 10:45:33","9/5/2024 10:45:33",,"0"
"402","9","1","2093","2024","","CONCEDE RECOMPOSIÇÃO INFLACIONARIA ANUAL AOS SERVIDORES DA CÂMARA  MUNICIPAL DE FRONTEIRA MINAS GERAIS",,"21/5/2024 08:47:38","21/5/2024 08:47:38",,"0"
"403","9","1","2092","2024","","DISPÕE SOBRE A CRIAÇÃO DO CONSELHO MUNICIPAL DOS DIREITOS DA MULHER - CMDM E DÁ OUTRAS PROVIDÊNCIAS.",,"21/5/2024 15:26:11","21/5/2024 15:26:11",,"0"
"404","9","1","2091","2024","","AUTORIZA O MUNICÍPIO DE FRONTEIRA/MG A PARTICIPAR DO CONSÓRCIO PÚBLICO INTERMUNICIPAL DE DESENVOLVIMENTO SUSTENTÁVEL DO TRIÂNGULO MINEIRO E ALTO PARANAÍBA – CIDES E DÁ OUTRAS PROVIDÊNCIAS.",,"21/5/2024 15:29:32","21/5/2024 15:29:32",,"0"
"405","1","1","7361","2024","","DISPÕE SOBRE A DECLARAÇÃO DE UTILIDADE PÚBLICA DO CONSELHO COMUNITARIO DE SEGURANÇA PÚBLICA E SOCIAL DE FRONTEIRA MG - CONSEP",,"28/5/2024 15:44:31","28/5/2024 15:44:31",,"0"
"406","1","1","7362","2024","","DECLARA DE UTILIDADE PÚBLICA, PARA FINS DE DESAPROPRIAÇÃO DE PLENO DOMÍNIO E CONSTITUIÇÃO DE SERVIDÃO, PELA COMPANHIA DE SANEAMENTO DE MINAS GERAIS – COPASA MG, IMÓVEIS NECESSÁRIOS AOS SISTEMAS DE ESGOTAMENTO SANITÁRIO E ABASTECIMENTO DE ÁGUA DO MUNICÍPIO DE FRONTEIRA/MG E DÁ OUTRAS PROVIDÊNCIAS.",,"29/5/2024 15:04:16","29/5/2024 15:04:16",,"0"
"407","1","1","7359","2024","","DISPÕE SOBRE A INCLUSÃO DE EVENTO NO CALENDÁRIO OFICIAL DE EVENTOS - TERCEIRO ARRAIAL DO JARDIM VERANEIO",,"5/6/2024 15:41:23","5/6/2024 15:41:23",,"0"
"408","1","1","7360","2024","","DISPÕE SOBRE A INCLUSÃO DE EVENTO NO CALENDÁRIO DE EVENTOS - QUERMESSE BENEFICIENTE",,"5/6/2024 15:51:09","5/6/2024 15:51:09",,"0"
"409","9","1","2095","2024","","INCLUI O PARÁGRAFO ÚNICO NO ART. 3º DA LEI Nº 1.987 DE 19 DE JANEIRO DE 2022",,"17/6/2024 16:27:17","17/6/2024 16:27:17",,"0"
"410","9","1","2094","2024","","ALTERA O ITEM 1 DO ANEXO ÚNICO DA LEI Nº 2.083 DE 27 DE MARÇO DE 2024, COM A ADEQUAÇÃO E RETIFICAÇÃO DOS DADOS PESSOAIS.",,"17/6/2024 16:28:34","17/6/2024 16:28:34",,"0"
"411","3","1","0001","2024","","AUTORIZA O MUNICÍPIO DE FRONTEIRA A CONCEDER DIREITO REAL DE USO DE IMÓVEIS DE SUA PROPRIEDADE, LOCALIZADOS NO DISTRITO INDUSTRIAL, MEDIANTE CONCORRÊNCIA PÚBLICA E DÁ OUTRAS PROVIDÊNCIAS. ",,"17/6/2024 16:31:36","17/6/2024 16:31:36",,"0"
"412","3","1","0002","2024","","AUTORIZA A RECOMPOSIÇÃO DA BASE REMUNERATORIA DOS AGENTES PUBLICOS DE FRONTEIRA",,"17/6/2024 16:49:40","17/6/2024 16:49:40",,"0"
"413","9","1","2096","2024","","AUTORIZA A CONCESSÃO DE SUBVENÇÃO SOCIAL AO CONSELHO COMUNITÁRIO DE SEGURANÇA PÚBLICA E SOCIAL DE FRONTEIRA-MG CONSEP",,"21/6/2024 13:54:32","21/6/2024 13:54:32",,"0"
"414","1","1","7385","2024","","ALTERA O CONSELHO MUNICIPAL DE DESENVOLVIMENTO ECONÔMICO SUSTENTÁVEL, E DÁ OUTRAS PROVIDÊNCIAS.",,"3/7/2024 09:03:51","3/7/2024 09:03:51",,"0"
"415","1","1","7387","2024","","DECLARA DE UTILIDADE PÚBLICA, PARA FINS DE DESAPROPRIAÇÃO DE PLENO DOMÍNIO E CONSTITUIÇÃO DE SERVIDÃO, PELA COMPANHIA DE SANEAMENTO DE MINAS GERAIS – COPASA MG, IMÓVEIS NECESSÁRIOS AOS SISTEMAS DE ESGOTAMENTO SANITÁRIO E/OU ABASTECIMENTO DE ÁGUA DO MUNICÍPIO DE FRONTEIRA/MG E DÁ OUTRAS PROVIDÊNCIAS.",,"3/7/2024 09:05:00","3/7/2024 09:05:00",,"0"
"416","1","1","7386","2024","","DIVULGA A “CARTILHA VEDAÇÕES DURANTE O PERÍODO ELEITORAL” AOS AGENTES PÚBLICOS DO PODER EXECUTIVO DO MUNICÍPIO DE FRONTEIRA-MG.",,"3/7/2024 09:06:15","3/7/2024 09:06:15",,"0"
"417","1","1","7351","2024","","DISPÕE SOBRE O CRONOGRAMA DE VENCIMENTO DO IPTU - IMPOSTO PREDIAL E TERRITORIAL URBANO, DO EXERCÍCIO DE 2024 - MUNICÍPIO DE FRONTEIRA-MG.",,"3/7/2024 15:02:31","3/7/2024 15:02:31",,"0"
"418","1","1","7411","2024","","ALTERA O DECRETO N° 7.183 QUE APROVA O CALENDÁRIO OFICIAL DE FERIADOS E PONTOS FACULTATIVOS",,"3/7/2024 15:08:38","3/7/2024 15:08:38",,"0"
"419","1","1","7431","2024","","DISPÕE SOBRE O DESCAUCIONAMENTO DE LOTES DADOS EM GARANTIA DE EXECUÇÃO DE OBRAS DE INFRAESTRUTURA NO LOTEAMENTO DENOMINADO “MARINAS NAUTICO RESIDENCE II”, APROVADO POR MEIO DO DECRETO Nº 3.357, DE 01 DE NOVEMBRO DE 2017 E DÁ OUTRAS PROVIDÊNCIAS.",,"15/8/2024 14:33:21","15/8/2024 14:33:21",,"0"
"420","9","1","2099","2024","","AUTORIZA A CONCESSÃO DE SUBVENÇÃO SOCIAL À ASSOCIAÇÃO DE COMBATE AO CÂNCER DO BRASIL CENTRAL E DÁ OUTRAS PROVIDÊNCIAS.",,"16/8/2024 16:05:28","16/8/2024 16:05:28",,"0"
"421","9","1","2097","2024","","AUTORIZA A CONCESSÃO DE SUBVENÇÃO SOCIAL À ASSOCIAÇÃO DE PAIS E AMIGOS DOS EXCEPCIONAIS DE FRONTEIRA-MG (APAE) E DÁ OUTRAS PROVIDÊNCIAS.",,"20/8/2024 09:24:17","20/8/2024 09:24:17",,"0"
"422","9","1","2100","2024","","AUTORIZA A ALIENAÇÃO DE BENS MÓVEIS E DÁ OUTRAS PROVIDÊNCIAS.",,"20/8/2024 09:34:23","20/8/2024 09:34:23",,"0"
"423","9","1","2101","2024","","DISPÕE SOBRE A ABERTURA DE CRÉDITO ADICIONAL ESPECIAL NO ORÇAMENTO VIGENTE PARA A INCLUSÃO DE AÇÃO EM PROGRAMA DO PPA, LDO e LOA E DÁ OUTRAS PROVIDÊNCIAS.",,"20/8/2024 09:37:11","20/8/2024 09:37:11",,"0"
"424","9","1","2102","2024","","FIXA O VALOR DO SUBSÍDIO MENSAL DOS VEREADORES MUNICIPAIS PARA O QUADRIÊNIO 2025/2028.",,"20/8/2024 13:10:38","20/8/2024 13:10:38",,"0"
"425","9","1","2103","2024","","FIXA O VALOR DO SUBSÍDIO MENSAL DO PREFEITO, VICE-PREFEITO E DOS SECRETÁRIOS MUNICIPAIS PARA O QUADRIÊNIO 2025/2028.",,"20/8/2024 13:12:21","20/8/2024 13:12:21",,"0"
"426","9","1","2104","2024","","PROÍBE O MANUSEIO, A UTILIZAÇÃO E A QUEIMA DE FOGOS DE ARTIFÍCIO DE EFEITO SONORO ALTO NO MUNÍCIPIO DE FRONTEIRA/MG, E DÁ OUTRAS PROVIDÊNCIAS.",,"20/8/2024 13:13:13","20/8/2024 13:13:13",,"0"
"427","1","1","7429","2024","","DESIGNA MEMBROS REPRESENTANTES DO PODER EXECUTIVO PARA O CONSELHO MUNICIPAL DE ASSISTÊNCIA SOCIAL DO MUNICÍPIO DE FRONTEIRA E DÁ OUTRAS PROVIDÊNCIAS.",,"22/8/2024 08:54:48","22/8/2024 08:54:48",,"0"
"428","1","1","6257","2021","","INSTITUI A IV CONFERÊNCIA MUNICIPAL DE EDUCAÇÃO DE FRONTEIRA",,"9/9/2024 13:32:03","9/9/2024 13:32:03",,"0"
"429","9","1","0838","1997","","DISPÕE SOBRE A CRIAÇÃO DO CONSELHO MUNICIPAL DE EDUCAÇÃO DO MUNICIPIO DE FRONTEIRA ",,"9/9/2024 16:33:39","9/9/2024 16:33:39",,"0"
"430","9","1","2106","2024","","
AUTORIZA A CONCESSÃO DE SUBVENÇÃO SOCIAL À ASSOCIAÇÃO DE PAIS E AMIGOS DOS EXCEPCIONAIS DE FRONTEIRA-MG (APAE) E DÁ OUTRAS PROVIDENCIAS ",,"12/9/2024 15:10:33","12/9/2024 15:10:33",,"0"
"431","9","1","2105","2024","","DISPÕE SOBRE A ABERTURA DE CRÉDITO ADICIONAL SUPLEMENTAR NO ORÇAMENTO VIGENTE E DÁ OUTRAS PROVIDÊNCIAS.",,"12/9/2024 15:17:39","12/9/2024 15:17:39",,"0"
"432","1","1","7392","2024","","DISPÕE SOBRE A INCLUSÃO DE EVENTO NO CALENDÁRIO DE EVENTOS OFICIAL DO MUNICÍPIO DE FRONTEIRA-MG, E DÁ OUTRAS PROVIDÊNCIAS. - 6° TORNEIO DA AMIZADE",,"13/9/2024 16:53:47","13/9/2024 16:53:47",,"0"
